{
  "schema_version": 1,
  "run_id": "b1d8634350834e0183dca21f164b5fc2",
  "attempt_id": "4e02058572dc4f04be465a9869944acb",
  "phase": "Plan",
  "input_plan_hash": "0f81d2c2d9cf89589ca407305c32ef837ee7ff560d1b2cc12ba8f53d5f214592",
  "base_plan_version": 0,
  "execution_plan_hash": null,
  "execution_plan": null,
  "decision": "ready",
  "route_hint": null,
  "summary": "成果物を全35既存項目へ補完し、変更前の性能基準測定T36を追加。36必須項目・16完成条件・11マイルストーンの対応と非循環依存を静的確認。既存条件は維持。製品変更・build/test/benchmarkは未実施、全項目pending。",
  "task_results": [
    {"id":"T01","status":"pending","evidence_ids":["4e02058572dc4f04be465a9869944acb_plan"],"remaining":["全規範条項の棚卸しと現物・検証への対応表は未実施。C01の達成証拠なし。"],"blocker":null},
    {"id":"T02","status":"pending","evidence_ids":["4e02058572dc4f04be465a9869944acb_plan"],"remaining":["受入・検証条件の実施が残る。現行の受理済み製品証拠なし。"],"blocker":null},
    {"id":"T03","status":"pending","evidence_ids":["4e02058572dc4f04be465a9869944acb_plan"],"remaining":["受入・検証条件の実施が残る。現行の受理済み製品証拠なし。"],"blocker":null},
    {"id":"T04","status":"pending","evidence_ids":["4e02058572dc4f04be465a9869944acb_plan"],"remaining":["受入・検証条件の実施が残る。現行の受理済み製品証拠なし。"],"blocker":null},
    {"id":"T05","status":"pending","evidence_ids":["4e02058572dc4f04be465a9869944acb_plan"],"remaining":["受入・検証条件の実施が残る。現行の受理済み製品証拠なし。"],"blocker":null},
    {"id":"T06","status":"pending","evidence_ids":["4e02058572dc4f04be465a9869944acb_plan"],"remaining":["受入・検証条件の実施が残る。現行の受理済み製品証拠なし。"],"blocker":null},
    {"id":"T07","status":"pending","evidence_ids":["4e02058572dc4f04be465a9869944acb_plan"],"remaining":["受入・検証条件の実施が残る。現行の受理済み製品証拠なし。"],"blocker":null},
    {"id":"T08","status":"pending","evidence_ids":["4e02058572dc4f04be465a9869944acb_plan"],"remaining":["受入・検証条件の実施が残る。現行の受理済み製品証拠なし。"],"blocker":null},
    {"id":"T09","status":"pending","evidence_ids":["4e02058572dc4f04be465a9869944acb_plan"],"remaining":["受入・検証条件の実施が残る。現行の受理済み製品証拠なし。"],"blocker":null},
    {"id":"T10","status":"pending","evidence_ids":["4e02058572dc4f04be465a9869944acb_plan"],"remaining":["受入・検証条件の実施が残る。現行の受理済み製品証拠なし。"],"blocker":null},
    {"id":"T11","status":"pending","evidence_ids":["4e02058572dc4f04be465a9869944acb_plan"],"remaining":["受入・検証条件の実施が残る。現行の受理済み製品証拠なし。"],"blocker":null},
    {"id":"T12","status":"pending","evidence_ids":["4e02058572dc4f04be465a9869944acb_plan"],"remaining":["受入・検証条件の実施が残る。現行の受理済み製品証拠なし。"],"blocker":null},
    {"id":"T13","status":"pending","evidence_ids":["4e02058572dc4f04be465a9869944acb_plan"],"remaining":["受入・検証条件の実施が残る。現行の受理済み製品証拠なし。"],"blocker":null},
    {"id":"T14","status":"pending","evidence_ids":["4e02058572dc4f04be465a9869944acb_plan"],"remaining":["受入・検証条件の実施が残る。現行の受理済み製品証拠なし。"],"blocker":null},
    {"id":"T15","status":"pending","evidence_ids":["4e02058572dc4f04be465a9869944acb_plan"],"remaining":["受入・検証条件の実施が残る。現行の受理済み製品証拠なし。"],"blocker":null},
    {"id":"T16","status":"pending","evidence_ids":["4e02058572dc4f04be465a9869944acb_plan"],"remaining":["受入・検証条件の実施が残る。現行の受理済み製品証拠なし。"],"blocker":null},
    {"id":"T17","status":"pending","evidence_ids":["4e02058572dc4f04be465a9869944acb_plan"],"remaining":["受入・検証条件の実施が残る。現行の受理済み製品証拠なし。"],"blocker":null},
    {"id":"T18","status":"pending","evidence_ids":["4e02058572dc4f04be465a9869944acb_plan"],"remaining":["受入・検証条件の実施が残る。現行の受理済み製品証拠なし。"],"blocker":null},
    {"id":"T19","status":"pending","evidence_ids":["4e02058572dc4f04be465a9869944acb_plan"],"remaining":["受入・検証条件の実施が残る。現行の受理済み製品証拠なし。"],"blocker":null},
    {"id":"T20","status":"pending","evidence_ids":["4e02058572dc4f04be465a9869944acb_plan"],"remaining":["受入・検証条件の実施が残る。現行の受理済み製品証拠なし。"],"blocker":null},
    {"id":"T21","status":"pending","evidence_ids":["4e02058572dc4f04be465a9869944acb_plan"],"remaining":["受入・検証条件の実施が残る。現行の受理済み製品証拠なし。"],"blocker":null},
    {"id":"T22","status":"pending","evidence_ids":["4e02058572dc4f04be465a9869944acb_plan"],"remaining":["受入・検証条件の実施が残る。現行の受理済み製品証拠なし。"],"blocker":null},
    {"id":"T23","status":"pending","evidence_ids":["4e02058572dc4f04be465a9869944acb_plan"],"remaining":["受入・検証条件の実施が残る。現行の受理済み製品証拠なし。"],"blocker":null},
    {"id":"T24","status":"pending","evidence_ids":["4e02058572dc4f04be465a9869944acb_plan"],"remaining":["受入・検証条件の実施が残る。現行の受理済み製品証拠なし。"],"blocker":null},
    {"id":"T25","status":"pending","evidence_ids":["4e02058572dc4f04be465a9869944acb_plan"],"remaining":["受入・検証条件の実施が残る。現行の受理済み製品証拠なし。"],"blocker":null},
    {"id":"T26","status":"pending","evidence_ids":["4e02058572dc4f04be465a9869944acb_plan"],"remaining":["受入・検証条件の実施が残る。現行の受理済み製品証拠なし。"],"blocker":null},
    {"id":"T27","status":"pending","evidence_ids":["4e02058572dc4f04be465a9869944acb_plan"],"remaining":["受入・検証条件の実施が残る。現行の受理済み製品証拠なし。"],"blocker":null},
    {"id":"T28","status":"pending","evidence_ids":["4e02058572dc4f04be465a9869944acb_plan"],"remaining":["受入・検証条件の実施が残る。現行の受理済み製品証拠なし。"],"blocker":null},
    {"id":"T29","status":"pending","evidence_ids":["4e02058572dc4f04be465a9869944acb_plan"],"remaining":["受入・検証条件の実施が残る。現行の受理済み製品証拠なし。"],"blocker":null},
    {"id":"T30","status":"pending","evidence_ids":["4e02058572dc4f04be465a9869944acb_plan"],"remaining":["受入・検証条件の実施が残る。現行の受理済み製品証拠なし。"],"blocker":null},
    {"id":"T31","status":"pending","evidence_ids":["4e02058572dc4f04be465a9869944acb_plan"],"remaining":["受入・検証条件の実施が残る。現行の受理済み製品証拠なし。"],"blocker":null},
    {"id":"T32","status":"pending","evidence_ids":["4e02058572dc4f04be465a9869944acb_plan"],"remaining":["受入・検証条件の実施が残る。現行の受理済み製品証拠なし。"],"blocker":null},
    {"id":"T33","status":"pending","evidence_ids":["4e02058572dc4f04be465a9869944acb_plan"],"remaining":["受入・検証条件の実施が残る。現行の受理済み製品証拠なし。"],"blocker":null},
    {"id":"T34","status":"pending","evidence_ids":["4e02058572dc4f04be465a9869944acb_plan"],"remaining":["受入・検証条件の実施が残る。現行の受理済み製品証拠なし。"],"blocker":null},
    {"id":"T35","status":"pending","evidence_ids":["4e02058572dc4f04be465a9869944acb_plan"],"remaining":["受入・検証条件の実施が残る。現行の受理済み製品証拠なし。"],"blocker":null},
    {"id":"T36","status":"pending","evidence_ids":["4e02058572dc4f04be465a9869944acb_plan"],"remaining":["実装変更前の基準測定とallocation検証は未実施。測定証拠なし。"],"blocker":null}
  ],
  "changes": [
    {"kind":"task","id":"T01","set":{"description":null,"required":null,"depends_on":null,"criterion_ids":null,"acceptance":null,"verification":null,"source_ids":null,"deliverables":["STATUS.md"],"replacements":null}},
    {"kind":"task","id":"T02","set":{"description":null,"required":null,"depends_on":["T01","T36"],"criterion_ids":null,"acceptance":null,"verification":null,"source_ids":null,"deliverables":["Kimi/Compiler/Lexing/**","Kimi/Compiler/Parsing/**","Kimi/Compiler/Core/**","Kimi/Compiler/Helper/**","xUnitTest/Tests/**","STATUS.md"],"replacements":null}},
    {"kind":"task","id":"T03","set":{"description":null,"required":null,"depends_on":null,"criterion_ids":null,"acceptance":null,"verification":null,"source_ids":null,"deliverables":["Kimi/Compiler/Core/**","Kimi/Compiler/Parsing/**","Kimi/SolutionAndProject/**","xUnitTest/Tests/**","STATUS.md"],"replacements":null}},
    {"kind":"task","id":"T04","set":{"description":null,"required":null,"depends_on":null,"criterion_ids":null,"acceptance":null,"verification":null,"source_ids":null,"deliverables":["Kimi/Compiler/Binding/**","Kimi/Compiler/Parsing/Koto/Types/**","xUnitTest/Tests/**","STATUS.md"],"replacements":null}},
    {"kind":"task","id":"T05","set":{"description":null,"required":null,"depends_on":null,"criterion_ids":null,"acceptance":null,"verification":null,"source_ids":null,"deliverables":["Kimi/Compiler/Binding/**","Kimi/Compiler/Core/**","xUnitTest/Tests/**","STATUS.md"],"replacements":null}},
    {"kind":"task","id":"T06","set":{"description":null,"required":null,"depends_on":null,"criterion_ids":null,"acceptance":null,"verification":null,"source_ids":null,"deliverables":["Kimi/Compiler/Binding/**","xUnitTest/Tests/**","STATUS.md"],"replacements":null}},
    {"kind":"task","id":"T07","set":{"description":null,"required":null,"depends_on":null,"criterion_ids":null,"acceptance":null,"verification":null,"source_ids":null,"deliverables":["Kimi/Compiler/Binding/**","xUnitTest/Tests/**","STATUS.md"],"replacements":null}},
    {"kind":"task","id":"T08","set":{"description":null,"required":null,"depends_on":null,"criterion_ids":null,"acceptance":null,"verification":null,"source_ids":null,"deliverables":["Kimi/Compiler/Binding/**","Kimi/Compiler/Analysis/**","xUnitTest/Tests/**","STATUS.md"],"replacements":null}},
    {"kind":"task","id":"T09","set":{"description":null,"required":null,"depends_on":null,"criterion_ids":null,"acceptance":null,"verification":null,"source_ids":null,"deliverables":["Kimi/Compiler/Binding/**","Kimi/Compiler/Analysis/**","xUnitTest/Tests/**","STATUS.md"],"replacements":null}},
    {"kind":"task","id":"T10","set":{"description":null,"required":null,"depends_on":null,"criterion_ids":null,"acceptance":null,"verification":null,"source_ids":null,"deliverables":["Kimi/Compiler/Binding/**","Kimi/Compiler/Helper/**","Kimi/Compiler/FloatingTypes.cs","Kimi/Compiler/ScalarTypes.cs","xUnitTest/Tests/**","STATUS.md"],"replacements":null}},
    {"kind":"task","id":"T11","set":{"description":null,"required":null,"depends_on":null,"criterion_ids":null,"acceptance":null,"verification":null,"source_ids":null,"deliverables":["Kimi/Compiler/Analysis/**","Kimi/Compiler/Binding/**","xUnitTest/Tests/**","STATUS.md"],"replacements":null}},
    {"kind":"task","id":"T12","set":{"description":null,"required":null,"depends_on":null,"criterion_ids":null,"acceptance":null,"verification":null,"source_ids":null,"deliverables":["Kimi/Compiler/Analysis/**","Kimi/Compiler/Binding/**","Kimi/Compiler/ReferenceTypes.cs","xUnitTest/Tests/**","STATUS.md"],"replacements":null}},
    {"kind":"task","id":"T13","set":{"description":null,"required":null,"depends_on":null,"criterion_ids":null,"acceptance":null,"verification":null,"source_ids":null,"deliverables":["Kimi/Compiler/Analysis/**","Kimi/Compiler/Binding/**","xUnitTest/Tests/**","STATUS.md"],"replacements":null}},